{
    "schema_version": "izzi.lenticular-resolved/1",
    "id": "lenticular-two",
    "axis": "vertical",
    "width_mm": 25.4,
    "height_mm": 25.4,
    "lenses_per_inch": 60.0,
    "phase_mm": 0.0,
    "period_mm": 0.4233333333333333,
    "strip_width_mm": 0.21166666666666664,
    "raster_ppi": 600.0,
    "integer_grid": true,
    "samples_per_strip": 5.0,
    "maximum_rounding_error_pixels": 1.1368683772161603e-13,
    "physical_proof": "not-performed",
    "view_order": [
        0,
        1
    ],
    "source_ids": [
        "lenticular-two-view-0",
        "lenticular-two-view-1"
    ],
    "crop": [
        0.0,
        0.0,
        320.0,
        320.0
    ],
    "statistics": {
        "path_count": 143,
        "point_count": 14326,
        "estimated_svg_bytes": 995340
    },
    "strips": [
        {
            "view": 0,
            "start_mm": 0.0,
            "end_mm": 0.21166666666666664
        },
        {
            "view": 1,
            "start_mm": 0.21166666666666664,
            "end_mm": 0.4233333333333333
        },
        {
            "view": 0,
            "start_mm": 0.4233333333333333,
            "end_mm": 0.6349999999999999
        },
        {
            "view": 1,
            "start_mm": 0.6349999999999999,
            "end_mm": 0.8466666666666666
        },
        {
            "view": 0,
            "start_mm": 0.8466666666666666,
            "end_mm": 1.0583333333333331
        },
        {
            "view": 1,
            "start_mm": 1.0583333333333331,
            "end_mm": 1.2699999999999998
        },
        {
            "view": 0,
            "start_mm": 1.2699999999999998,
            "end_mm": 1.4816666666666665
        },
        {
            "view": 1,
            "start_mm": 1.4816666666666665,
            "end_mm": 1.6933333333333331
        },
        {
            "view": 0,
            "start_mm": 1.6933333333333331,
            "end_mm": 1.9049999999999998
        },
        {
            "view": 1,
            "start_mm": 1.9049999999999998,
            "end_mm": 2.1166666666666663
        },
        {
            "view": 0,
            "start_mm": 2.1166666666666663,
            "end_mm": 2.328333333333333
        },
        {
            "view": 1,
            "start_mm": 2.328333333333333,
            "end_mm": 2.5399999999999996
        },
        {
            "view": 0,
            "start_mm": 2.5399999999999996,
            "end_mm": 2.7516666666666665
        },
        {
            "view": 1,
            "start_mm": 2.7516666666666665,
            "end_mm": 2.963333333333333
        },
        {
            "view": 0,
            "start_mm": 2.963333333333333,
            "end_mm": 3.175
        },
        {
            "view": 1,
            "start_mm": 3.175,
            "end_mm": 3.3866666666666663
        },
        {
            "view": 0,
            "start_mm": 3.3866666666666663,
            "end_mm": 3.5983333333333327
        },
        {
            "view": 1,
            "start_mm": 3.5983333333333327,
            "end_mm": 3.8099999999999996
        },
        {
            "view": 0,
            "start_mm": 3.8099999999999996,
            "end_mm": 4.0216666666666665
        },
        {
            "view": 1,
            "start_mm": 4.0216666666666665,
            "end_mm": 4.2333333333333325
        },
        {
            "view": 0,
            "start_mm": 4.2333333333333325,
            "end_mm": 4.444999999999999
        },
        {
            "view": 1,
            "start_mm": 4.444999999999999,
            "end_mm": 4.656666666666666
        },
        {
            "view": 0,
            "start_mm": 4.656666666666666,
            "end_mm": 4.868333333333333
        },
        {
            "view": 1,
            "start_mm": 4.868333333333333,
            "end_mm": 5.079999999999999
        },
        {
            "view": 0,
            "start_mm": 5.079999999999999,
            "end_mm": 5.291666666666666
        },
        {
            "view": 1,
            "start_mm": 5.291666666666666,
            "end_mm": 5.503333333333333
        },
        {
            "view": 0,
            "start_mm": 5.503333333333333,
            "end_mm": 5.714999999999999
        },
        {
            "view": 1,
            "start_mm": 5.714999999999999,
            "end_mm": 5.926666666666666
        },
        {
            "view": 0,
            "start_mm": 5.926666666666666,
            "end_mm": 6.138333333333333
        },
        {
            "view": 1,
            "start_mm": 6.138333333333333,
            "end_mm": 6.35
        },
        {
            "view": 0,
            "start_mm": 6.35,
            "end_mm": 6.561666666666666
        },
        {
            "view": 1,
            "start_mm": 6.561666666666666,
            "end_mm": 6.7733333333333325
        },
        {
            "view": 0,
            "start_mm": 6.7733333333333325,
            "end_mm": 6.984999999999999
        },
        {
            "view": 1,
            "start_mm": 6.984999999999999,
            "end_mm": 7.196666666666665
        },
        {
            "view": 0,
            "start_mm": 7.196666666666665,
            "end_mm": 7.408333333333332
        },
        {
            "view": 1,
            "start_mm": 7.408333333333332,
            "end_mm": 7.619999999999999
        },
        {
            "view": 0,
            "start_mm": 7.619999999999999,
            "end_mm": 7.831666666666666
        },
        {
            "view": 1,
            "start_mm": 7.831666666666666,
            "end_mm": 8.043333333333333
        },
        {
            "view": 0,
            "start_mm": 8.043333333333333,
            "end_mm": 8.254999999999999
        },
        {
            "view": 1,
            "start_mm": 8.254999999999999,
            "end_mm": 8.466666666666665
        },
        {
            "view": 0,
            "start_mm": 8.466666666666665,
            "end_mm": 8.678333333333333
        },
        {
            "view": 1,
            "start_mm": 8.678333333333333,
            "end_mm": 8.889999999999999
        },
        {
            "view": 0,
            "start_mm": 8.889999999999999,
            "end_mm": 9.101666666666665
        },
        {
            "view": 1,
            "start_mm": 9.101666666666665,
            "end_mm": 9.313333333333333
        },
        {
            "view": 0,
            "start_mm": 9.313333333333333,
            "end_mm": 9.524999999999999
        },
        {
            "view": 1,
            "start_mm": 9.524999999999999,
            "end_mm": 9.736666666666666
        },
        {
            "view": 0,
            "start_mm": 9.736666666666666,
            "end_mm": 9.948333333333332
        },
        {
            "view": 1,
            "start_mm": 9.948333333333332,
            "end_mm": 10.159999999999998
        },
        {
            "view": 0,
            "start_mm": 10.159999999999998,
            "end_mm": 10.371666666666666
        },
        {
            "view": 1,
            "start_mm": 10.371666666666666,
            "end_mm": 10.583333333333332
        },
        {
            "view": 0,
            "start_mm": 10.583333333333332,
            "end_mm": 10.794999999999998
        },
        {
            "view": 1,
            "start_mm": 10.794999999999998,
            "end_mm": 11.006666666666666
        },
        {
            "view": 0,
            "start_mm": 11.006666666666666,
            "end_mm": 11.218333333333332
        },
        {
            "view": 1,
            "start_mm": 11.218333333333332,
            "end_mm": 11.429999999999998
        },
        {
            "view": 0,
            "start_mm": 11.429999999999998,
            "end_mm": 11.641666666666666
        },
        {
            "view": 1,
            "start_mm": 11.641666666666666,
            "end_mm": 11.853333333333332
        },
        {
            "view": 0,
            "start_mm": 11.853333333333332,
            "end_mm": 12.064999999999998
        },
        {
            "view": 1,
            "start_mm": 12.064999999999998,
            "end_mm": 12.276666666666666
        },
        {
            "view": 0,
            "start_mm": 12.276666666666666,
            "end_mm": 12.488333333333332
        },
        {
            "view": 1,
            "start_mm": 12.488333333333332,
            "end_mm": 12.7
        },
        {
            "view": 0,
            "start_mm": 12.7,
            "end_mm": 12.911666666666665
        },
        {
            "view": 1,
            "start_mm": 12.911666666666665,
            "end_mm": 13.123333333333331
        },
        {
            "view": 0,
            "start_mm": 13.123333333333331,
            "end_mm": 13.334999999999999
        },
        {
            "view": 1,
            "start_mm": 13.334999999999999,
            "end_mm": 13.546666666666665
        },
        {
            "view": 0,
            "start_mm": 13.546666666666665,
            "end_mm": 13.758333333333331
        },
        {
            "view": 1,
            "start_mm": 13.758333333333331,
            "end_mm": 13.969999999999999
        },
        {
            "view": 0,
            "start_mm": 13.969999999999999,
            "end_mm": 14.181666666666665
        },
        {
            "view": 1,
            "start_mm": 14.181666666666665,
            "end_mm": 14.39333333333333
        },
        {
            "view": 0,
            "start_mm": 14.39333333333333,
            "end_mm": 14.604999999999999
        },
        {
            "view": 1,
            "start_mm": 14.604999999999999,
            "end_mm": 14.816666666666665
        },
        {
            "view": 0,
            "start_mm": 14.816666666666665,
            "end_mm": 15.028333333333332
        },
        {
            "view": 1,
            "start_mm": 15.028333333333332,
            "end_mm": 15.239999999999998
        },
        {
            "view": 0,